<?xml version="1.0" encoding="UTF-8"?>

<xs:schema version="1.0"
           xmlns:xs="http://www.w3.org/2001/XMLSchema"
           elementFormDefault="qualified">
    
    <xs:element name="person_list">
        <xs:complexType>
            <xs:sequence>
                <xs:element name="person" minOccurs="1" maxOccurs="unbounded">
                    <xs:complexType>
                        <xs:sequence>
                            <xs:element name="name" type="xs:string"/>
                            <xs:element name="gender">
                                <xs:simpleType>
                                    <xs:restriction base="xs:string">
                                        <xs:pattern value="(Male|Female)"/>
                                    </xs:restriction>
                                </xs:simpleType>
                            </xs:element>
                            <xs:element name="contact">
                                <xs:complexType>
                                    <xs:sequence>
                                        <xs:element name="phone">
                                            <xs:simpleType>
                                                <xs:restriction base="xs:string">
                                                    <xs:pattern value="[0-9]{10}"/>
                                                </xs:restriction>
                                            </xs:simpleType>
                                        </xs:element>
                                        <xs:element name="email">
                                            <xs:simpleType>
                                                <xs:restriction base="xs:string">
                                                    <xs:pattern value="[^@]+@[^\.]+\..+"/>
                                                </xs:restriction>
                                            </xs:simpleType>
                                        </xs:element>
                                        <xs:element name="address" type="xs:string"/>
                                    </xs:sequence>
                                </xs:complexType>
                            </xs:element>
                        </xs:sequence>
                        <xs:attribute name="id">
                            <xs:simpleType>
                                <xs:restriction base="xs:string">
                                    <xs:pattern value="P[0-9]{3}"/>
                                </xs:restriction>
                            </xs:simpleType>
                        </xs:attribute>
                    </xs:complexType>
                </xs:element>
            </xs:sequence>
        </xs:complexType>
    </xs:element>

</xs:schema>